[
  {
    "version": "v1",
    "date": "2026-07-07",
    "title": "导入导出 + 单工单单 SKU",
    "changes": [
      { "item": "导入", "desc": "Excel 批量新建工单，模板含客户/仓库/SKU/优先级/备注" },
      { "item": "导出", "desc": "导出当前筛选结果全部列，含 SKU 尺寸/重量/图片" },
      { "item": "单 SKU", "desc": "每工单仅绑定 1 个 SKU，进度 0/1 或 1/1" },
      { "item": "删除订单号", "desc": "移除出库单关联及自动填充" },
      { "item": "PRD", "desc": "同步 list.import-modal、form-modal、验收标准" }
    ]
  },
  {
    "version": "v1",
    "date": "2026-07-06",
    "title": "审核页图片可编辑与文档对齐",
    "changes": [
      { "item": "审核页图片", "desc": "支持上传/删除，与尺寸/重量一并可改" },
      { "item": "对照定位", "desc": "detail/audit review-id 与 PRD 锚点对齐" }
    ]
  },
  {
    "version": "v1",
    "date": "2026-07-06",
    "title": "详情/审核独立页面",
    "changes": [
      { "item": "详情页", "desc": "左右布局 + 操作时间轴，只读" },
      { "item": "审核页", "desc": "可编辑 SKU + 保存/退回/完结" }
    ]
  },
  {
    "version": "v1",
    "date": "2026-07-06",
    "title": "待仓库处理支持编辑",
    "changes": [
      { "item": "行操作", "desc": "待仓库处理/已退回可编辑工单" }
    ]
  },
  {
    "version": "v1",
    "date": "2026-07-06",
    "title": "客户代码与出库单引用",
    "changes": [
      { "item": "客户代码", "desc": "列表筛选/列、表单字段、详情展示" },
      { "item": "订单号", "desc": "选中后自动填充客户、仓库、SKU 列表" },
      { "item": "SKU 表格", "desc": "新增/删除行，展示 SKU、尺寸、重量" }
    ]
  },
  {
    "version": "v1",
    "date": "2026-07-06",
    "title": "SKU 信息填充初版",
    "changes": [
      { "item": "列表页", "desc": "工单检索、状态筛选、行操作（查看/审核/编辑）" },
      { "item": "审核页", "desc": "展示已提交 SKU，支持编辑、退回、完结" },
      { "item": "表单页", "desc": "新建工单：选 SKU、备注、优先级、仓库代码" }
    ]
  }
]
