[
  {
    "version": "v1.0.5",
    "date": "2026-07-05",
    "title": "批量操作全量兼容",
    "changes": [
      { "item": "全量操作", "desc": "未勾选时批量确认/删除作用于当前列表全部记录" },
      { "item": "勾选操作", "desc": "有勾选时仍仅作用于选中行" }
    ]
  },
  {
    "version": "v1.0.4",
    "date": "2026-07-05",
    "title": "批量确认",
    "changes": [
      { "item": "批量确认", "desc": "支持勾选与全选后批量确认，二次确认弹窗" },
      { "item": "批量操作", "desc": "批量确认与批量删除均须二次确认" }
    ]
  },
  {
    "version": "v1.0.3",
    "date": "2026-07-05",
    "title": "检索与列表列调整",
    "changes": [
      { "item": "检索条件", "desc": "新增配送渠道、导入时间（起止）筛选" },
      { "item": "列表列", "desc": "移除承运商金额列（详情弹窗仍保留）" }
    ]
  },
  {
    "version": "v1.0.2",
    "date": "2026-07-05",
    "title": "导入弹窗异步阈值",
    "changes": [
      { "item": "移除解析步骤", "desc": "选文件后自动识别条数，无需点击解析" },
      { "item": "异步阈值", "desc": "超过 1000 条直接提交异步任务并提示用户" }
    ]
  },
  {
    "version": "v1.0.1",
    "date": "2026-07-05",
    "title": "列表交互优化",
    "changes": [
      {
        "item": "导入弹窗",
        "desc": "导入改为列表页弹窗，不再跳转独立表单页"
      },
      {
        "item": "批量删除",
        "desc": "支持勾选与全选后批量删除补收记录"
      },
      {
        "item": "配送渠道",
        "desc": "列表与详情新增配送渠道字段"
      }
    ]
  },
  {
    "version": "v1.0.0",
    "date": "2026-07-05",
    "title": "快递补收 v1 初版",
    "changes": [
      {
        "item": "Excel 导入",
        "desc": "支持上传承运商账单，按运单号匹配订单并自动算价"
      },
      {
        "item": "补差确认",
        "desc": "运营可查看详情、确认补收记录或删除无效导入"
      }
    ]
  }
]
