[
  {
    "version": "v1.2.0",
    "date": "2026-07-05",
    "title": "规则生效逻辑优化",
    "changes": [
      { "item": "闭区间匹配", "desc": "startTime ≤ event_time ≤ endTime；结束默认 23:59:59，新 start 默认次日 00:00:00" },
      { "item": "发布前影响预览", "desc": "重叠阻断、自动截断、规则快照冻结" },
      { "item": "生效状态", "desc": "列表展示生效中/待生效/已过期/未发布" }
    ]
  },
  {
    "version": "v1.1.0",
    "date": "2026-07-05",
    "title": "引用价卡后三张费用卡片",
    "changes": [
      {
        "item": "三张费用卡片",
        "desc": "选择价卡后展示快递费/库内费用/其他费用卡片，结构与价卡管理一致"
      },
      {
        "item": "费用项表格",
        "desc": "默认带出价卡费用规则行，支持增删行与折扣设置"
      },
      {
        "item": "详情弹窗",
        "desc": "费用项折扣按三张卡片分类展示"
      }
    ]
  },
  {
    "version": "v3.3.0",
    "date": "2026-06-21",
    "title": "发布冲突校验与作废复制新增",
    "changes": [
      {
        "item": "发布冲突校验",
        "desc": "同客户+仓库+费用类型+生效期重叠时阻断发布"
      },
      {
        "item": "作废复制新增",
        "desc": "已作废规则支持复制新增创建草稿"
      }
    ]
  }
]
